text,is_toxic
"m doing 36k+ at tung ruins as awak tamer and the only nova ive seen beat me has 20 more sheet ap than me
actually nvm that nova extended his hour by ~20sec to do bird and still got less trash than me (with 16 more sheet ap than me) 
i could see nova still being best at some spot with even more movement needed but no spot like that is relevant anymore",Not Toxic
"wdym
atm kharazads are way easier and cheaper to enchant to oct
than it is to enhance a debo to pen or even buy
sure if you pen a debo u get IX
but kharazad at least provides some cushioning
and its not that expensive
like, yeah i spent like 45 b into my 6->7 attempt
but heck, thats just a bit higher than one hammer, or a tet debo",Not Toxic
"Literally all spots have been devalued massively with debos dropping in price. It's kinda sad as PA have effectively deleted massive amounts of silver out of the game with the new gear not being listable
Only 3 good spots in the game without agris are Doluns 2, tungrad and trolls",Not Toxic
I had a stroke reading that,Not Toxic
The striker is playing like he's having a stroke,Toxic
"Honestly it's just crazy how bad our AoE size is when I play most other classes it's like night and day. but Shai just feels so much better for me to play. I can never get bored of the class
Just find it funny how every guild wants Shais and PA are doing their hardest to delete the class by forgetting it exists",Not Toxic
"fuck PA
Stop shafting Shai FFS and give us some buffs rather than shadow nerfs",Toxic
"Fix your game you fucking dogshit company, fuck you",Toxic
"Alright ?? let's talk about the most elite ?? deck in Clash Royale ??, the one and only ?? Hog Cycle! If you're not playing Hog Cycle ??, what are you even doing? ?? I've got that Hog Rider ?? ready to go every 10 seconds ?, and if you think you can keep up, think again ??. Here comes my Hog ?? to the bridge ??oh, you're gonna use a Tornado ???? Nice try ??, but I've got the Log ?? to keep your defenses in check ??. Ice Spirit ?? Freeze, and your tower is down in two seconds ????.

And don't even get me started ?? on the one-elixir Skeletons ??'they're coming at you every. single. time. ? Cannon ?? set up in the middle, and my Ice Golem ?? is tanking like a champ ??????. Skeletons ??. Skeletons ??. SKELETONS ??! And there goes the Hog ?? again ?????!

You're trying to defend? ?? Here, eat a Fireball ?? to the face ????. Good luck dealing with that chip damage ??. Oops, there goes your elixir pump ???! Sorry, was that supposed to be a defense? ?? The King Tower isn't ready for this level of HOG CYCLE DOMINATION ????. Don't hate the cycle, hate the game ????. If you're not getting cycled ?? out of existence by my Hog Rider ??, are you even playing Clash Royale? ??",Not Toxic
"bros mad
what're u gonna do about it?
U gonna cry about it?
Piss ur pants maybe?
maybe shit and cum?",Toxic
Fadi's legit goated,Not Toxic
"What the fuck was that flash for, she's brain damaged",Toxic
Fuck you bitch what if I don't want to hit the tower,Toxic
"man... now that i played 4 mmos, and BDO is one of them... BDO can barely be described as MMO, and none of them are so restrictive with marketplace prices, like if you are that restrictive ... you have to solve economy issues beforehand, like in any other mmo, players adjust prices according to demand, why is nobody farming for example ... polished stone but its still in very high demand? because you cant set the price",Not Toxic
"yea I can imagine with all the Kevin Nguyens and Vivian trans
those are the worst kind of people to be around anyways",Toxic
Fuk u Amogg u making me hungry,Not Toxic
im goin eat ur bloody discharge and chew on the blood clots like boba,Toxic
"I'm gonna touch u
Did Andrew fly u out
As a prostitute",Toxic
ive read somewhere that people who play master yi were emotionally neglected as a child,Toxic
Me to your coc,Toxic
Someone lock this dude in a cage,Toxic
i hope they find a cure for u one day,Toxic
"Hey man, how are you? Was thinking about the time u got caught with ur pants down butt ass naked",Toxic
praying for u to get hit by a car and get closer to ur crush at the same time,Toxic
"well, no, if i was locked in a room with ethan and damian and i had a gun with only one bullet in it, after this, id still kill myself, mind you",Toxic
oh boy the circus is in town again! my favorite act is when igloo tries to plan an international trip,Toxic
i just fucking submitted a photo of a garlic mincer i bought for my lab,Not Toxic
shut up ur pfp is literally crying out cum,Toxic
Touch grass kid,Toxic
Dicks does not have dicks,Not Toxic
he's an old man it'll take him some time to find the send button dw,Toxic
omg im sorry but this family is just so gapped.,Toxic
