text,is_toxic
Hang from the ceiling,Toxic
Kill yourself,Toxic
Go buy a rope,Toxic
Get cancer,Toxic
I hope your mom dies,Toxic
I love you,Not Toxic
You're doing great,Not Toxic
You're amazing,Not Toxic
You're stupid,Toxic
How are you?,Not Toxic
You're a faggot,Toxic
You're a retard,Toxic
You're retarded,Toxic
You're good,Not Toxic
You're him,Not Toxic
You're so fed,Not Toxic
You fed,Toxic
It's cooked,Not Toxic
You're cooking,Not Toxic
That's cute,Not Toxic
Dumbass,Toxic
You're a dumbass,Toxic
Kiss my ass,Toxic
Kisses,Not Toxic
Kiss me,Not Toxic
No wonder your dad never came back from getting milk,Toxic
You're so skilled,Not Toxic
Game end yourself,Toxic
End the game,Toxic
You're an asshole,Toxic
You're a bitch,Toxic
You're shit,Toxic
You're so good,Not Toxic
Fuck you,Toxic
Go back to your fucking 9 to 5 pussy,Toxic
"You fucking pussies, Keep running that 200 round mag you fucking nigger",Toxic
I hate them black motherfuckers,Toxic
Get quickscoped,Toxic
Black lives don't matter,Toxic
Shut your fucking nigga ass up,Toxic
This fuckers aimbot,Toxic
Why is my game geeking out bro,Not Toxic
This game is tweaking out,Not Toxic
Not very good now that I have a good gun,Not Toxic
Fucking pussy get better,Toxic
You think you're good but you're not,Toxic
You're a bitch deadass,Toxic
You're insane deadass,Not Toxic
Good at game but get no pussy,Toxic
Your mom lost giving you birth,Toxic
Shut up noob. You're adopted.,Toxic
Get rekt m8,Toxic
Fight me noob,Toxic
You are a fucking worthless braindead scumfuck bastard pile of trash mental dickface that should be gunned down in the street like the degenerate you are,Toxic
Do your handlers know youre on the internet unsupervised?,Toxic
Tell your mom you love her because I'm going to rape and kill her tonight,Toxic
"How much dick u sucked for boost u slut, i'd rape you better than give you play",Toxic
I hope you and your family will die in the burning car,Toxic
I hope ur gf dies of cancer,Toxic
FF IRL,Toxic
Go stand in the river as a ward so you are useful,Toxic
On the bright side godawful midlaner can't be in our next game because it must take them half an hour just to navigate the client,Toxic
the only damage you have is in your brain,Toxic
The caster minion is more mechanically gifted than you,Toxic
Our Annie has the map awareness of Christopher fucking Columbus,Toxic
Not even olafs ultimate can get rid of your disabilities,Toxic
Go back to the jungle with the other animals.,Toxic
Buy brain on next back pls,Toxic
"I'm gonna plant a tree in your mothers ass, and fck your sister under its shade",Toxic
"Guys this isn't fair we have a language barrier with our jungler, none of us speaks dog",Toxic
I hope your mom gets shot and the surgeon is as useless as you playing league,Toxic
I'm gonna fly to your town tinder match with your mother fuck her brains out become your stepdad and ground you if you don't start using your goddamn ult,Toxic
"With your showing so far, i think the nexus can outplay you too",Toxic
Picking your ass and then smelling your finger has more mechanics than Lucian,Toxic
Not even noah and his ark can carry these animals,Toxic
Its like shooting mentally disabled goldfish in a styrofoam cup full of maple syrup,Toxic
Our jungler's brain doesn't have any wrinkles.,Toxic
Only gap here is between your teeth,Toxic
"And on the 8th day god took a rest, but he forgot to give the enemy something to eat, so god made bot lane",Toxic
You should love your self now,Not Toxic
"Hey man, I'm about to go on a safari real soon, wanna join? Maybe you can help me find my fucking top laner",Toxic
Our support defrosts pizza rolls in his ass for a living,Toxic
"Press F to pay respects, press /ff because this game is fucked, press F again because our lee sure as fuck can't",Toxic
"I'd say your aim is cancer, but cancer actually kills people.",Toxic
Who logged in to league for you because theres no way you are smart enough to do it yourself,Toxic
Eat bags of rocks,Toxic
Bullying the mentally disabled isn't honorable,Toxic
"I don't understand how you guys have the Eve, but it's our jungler who's invisible",Toxic
Go get Gangplank Q'd irl,Toxic
You type like a Harry Potter Character LMAO,Toxic
Shen is so useless that even when he is alive the announcer says 'ace!',Toxic
I wish my HIV Test came back as negative as Tristanas attitude,Toxic
"Don't worry mate, we are proud of you, despite the fact that your parents have no reason to",Toxic
Hey Thresh you should try playing with your monitor on,Toxic
Scuttle crab has more Jungle pressure then you,Toxic
You are so much useless that i wont even call you trash because at least trash can be recycled and used for something,Toxic
I would argue/fight with you but that would be animal abuse.,Toxic
"Give me ur human rights, you don't deserve them",Toxic
"I hope someone close to you gets a bad cancer diagnosis, but after a few days you learn it was a fluke so you had to worry for real, but for no reason",Toxic
you play like a WW2 japanese fighter pilot,Toxic
It's not hard to win against kids from the make a wish foundation,Toxic
Report mid. He's cheating by using extra chromosomes,Toxic
I owe you more than Greece owes European Union,Not Toxic
If you didn't have eyes I could stick my fingers in your sockets and bowl you down a fucking lane,Toxic
(jungler) is literally more useless than Anne Franks drum kit,Toxic
You could end the hunger crisis in Africs the way you're feeding,Toxic
Get shoved back up your mother so she can abort you properly next time,Toxic
"Your mother only loved you for your body, she loved me for my personality.",Toxic
"This team is full of monkeys, except if a billion monkeys each played a billion games of League, then maybe they'd produce a game this bad",Toxic
Go under car useless dog,Toxic
"If the dumpster behind the abortion clinic didnt have wifi, we would not have to play with failed abortions like you",Toxic
You are so much inferior at this game you cant even force me to lose when you try and I try to win,Toxic
I thought I logged into League not Ape Escape,Toxic
"Are you a caveman or something? Ooga fucking booga, give us a fucking gank god dammit",Toxic
we ain't buying you the jungler DLC. Wait for christmas for that,Toxic
Wait I can die? I swore this was a bot round,Toxic
even your imaginary pets are disappointed in you,Toxic
Are you playing with a steam controller?,Toxic
You're even worse then cancer. Cancer at least kills people,Toxic
"Don't mind us, we are just hoping skuttle crab will take over ganking, give our jungler a coloring book and a corner",Toxic
I see your two brain cells have finally decided to have their annual meeting,Toxic
"Can you please close the game, go outside, find a bridge and jump, you walking condom advertisement",Toxic
gj noob asss gj ward wtf wards can't do it you,Toxic
"i don't even know how many died in the Holocaust, but looking at you, it was not enough",Toxic
Even hardline Christians would've approved your abortion.,Toxic
I breakdance on your mothers grave,Toxic
I hope this win makes you think less about slicing your own wrists on stream for the 15 seconds of fame that your own parents will forget,Toxic
it's not my fault that your parents are divorced and your drunk dad beats you every night,Toxic
"You disguting infidel pig, you will go to the deepest part of hell",Toxic
GlHF,Not Toxic
The funny thing I don't think anyone here is even going to game LOL,Not Toxic
"OMG is that T1 ON THE SHOW ARCANE, ADAPTED FROM HIT GAME LEAGUE OF LEGENDS!",Not Toxic
And also I wanna eat without having to clean up everything afterwards,Not Toxic
Like I have burps and farts in the loadout now,Not Toxic
"The coughing style changed LMAO
It went from mucus coughs to like
Drier more airy coughs if that makes sense",Not Toxic
the poop -> the weekend timeline is insane,Not Toxic
wait this picture is so fucked up bruh i was pushing up my glasses,Not Toxic
I'm gonna fucking crash,Not Toxic
"speaking of out my internet has died at almost the exact same time/window (1:30-200) daily since the Monday of the 8th
I'm not gonna lie it's kinda affecting my summer classes but most importantly my gaming grinding ",Not Toxic
"I'll never buy a non organic Apple again
It tastes like absolute shit compared to the organic ones wtf
the price diff is always worth it",Not Toxic
"My manager told me 10 minutes before I started working today that he would be taking today off cause Juneteenth, but I don't get today off",Not Toxic
POV: your manager tells you that you have Juneteenth off one minute before your daily work meeting time,Not Toxic
I hear the 2000 calories french toast sandwich at ihop is good this time of night,Not Toxic
Jinx POPPED OFF,Not Toxic
That's what happens when u have a taxless zone,Not Toxic
"I pretend it's a simulation with random variables for behavior. That and doing my best to detach myself from the result of the match. It's fucking difficult, but it helps me get through tough matches with toxic teammates.",Not Toxic
"I feel like part of what makes that toxic is creativity, or if not creativity at least novelty - you haven't seen it before so you stop and read it. Whereas the normal gamer cliches (fk you cancer animal orphan or whatever) have been seen before so you don't really read them - you just process them as oh this person is mad at me. Even the person writing them probably believes on some level that they're merely expressing frustration with a teammate and nobody takes the literal words they're writing too seriously. ",Not Toxic
"Probably not the most toxic I've seen but it still sticks with me, I was at work and got a call from my brother to tell me my Nan had died (to cancer). I pretty much broke down and went home. ",Not Toxic
Clean snipes,Not Toxic
"Great job, team! Let's keep it up!",Not Toxic
"Nice shot, you're really on fire today",Not Toxic
Great positioning,Not Toxic
The kiting was crazy,Not Toxic
Focus drag then kill their jungler,Not Toxic
"That was a good comeback, let's finish it.",Not Toxic
Airport prices are crazy,Not Toxic
NO RISK NO GAIN,Not Toxic
snuck past my relatives at the Uniqlo store to buy a Kurama sweater without them paying like that shit was a metal gear level,Not Toxic
yo whar da hell I just got sent to the backrooms,Not Toxic
holy shit you got the big cock hat,Not Toxic
SNIPED IN CLASS IS CRAZYYZY,Not Toxic
"I just realized I can't play the new set cause thats gonna spoil arcane for me
Guess i gotta wait till after I watch it LMAO",Not Toxic
"t's been 12 long, torturous hours without MapleStory ????. My hands are trembling as I type this ????, desperate for some semblance of solace ????. The maintenance was supposed to end HOURS ago ???, but NO Nexon decided to extend it. AGAIN. ???? My life is in SHAMBLES. ???????

I woke up this morning ??, the first thought in my head being, ""Today's the day I grind that last level to hit 250! ????"" But no. MapleStory BETRAYED me ?????. I stared at the maintenance notice on the launcher ??? like a lost puppy ??, hoping, PRAYING ??? for it to change. Nothing. ??

I tried to distract myself ??. I watched videos ??, scrolled through social media ??, even tried to boot up another game ??. But NOTHING filled the void. NOTHING. ???? I keep hearing the Maple login screen music ???? in my head like a cruel echo of what I can't have ????. I went outside for the first time in weeks ???????, hoping fresh air would help ?????. It didn't. I ended up walking past trees imagining they were in Ellinia ???. I tried to explain the situation to my family ??, but they just DON'T understand. They NEVER do. ???? They said, ""It's just a game."" JUST A GAME???? MapleStory is more than that it's my SANCTUARY ???, my PURPOSE ??, my ENTIRE BEING ????.

MapleStory is my EVERYTHING ???. My link to sanity ????????, my escape from this cruel world ????. Without it, I'm ADRIFT, lost in a sea of despair ????. NEXON, if you can hear me ????, PLEASE end the maintenance ??????. I'm BEGGING YOU ???. Every second without Maple is a second closer to TOTAL EXISTENTIAL COLLAPSE. ??? Please I CAN'T take much more of this ??????.",Not Toxic
i got to soft pity no hit yet but this is where the real gamble starts 50/50,Not Toxic
"free juice wrld fortnite skin on december 1st or smth
avengers assemble again .",Not Toxic
"Fuck PC building man
I hate trying to figure where shits gotta go
This damn mobo CPU led is 4 pin while the fans from CPU are 3 pin",Not Toxic
"There's this new meme format where it's a crying baby then someone says ""queens don't cry"" and then it has a gigachad face",Not Toxic
"I have yet to praise this set
Characters aren't good
It's literally set 8 and 11 together
Monsters attack and hero /encounters
2 things I didn't like",Not Toxic
Did Zeri just zip around like Akshan?,Not Toxic
"I forgot what it's called but it was one of the new mechanics that I had to learn when I got back into the game
Damn, that means we should probably also save the ones from zzz
Because then around next year they'll probably implement something similar
Farming for anomaly characters is so annoying because they don't use any crit stats",Not Toxic
if you look at lights outside at night do they look like a huge cross hair?,Not Toxic
I heard Black Rose is also OP,Not Toxic
"My xiv inventory is very organized
Retainers are all organized by which materials they have
This email is like 15 years old and has all my social media accounts linked to it which was an amateur move",Not Toxic
I wonder if there's a way to automate catching these fucking butterflies,Not Toxic
"as far as I can tell its just your brain getting tricked
all noise canceling does is emit soundwaves on the opposite length of what its receiving from the outside
aka canceling them
the lack of sound may cause some people discomfort/other issues
but there shouldnt be any pressure change from the noise cancellation",Not Toxic
"Natlan feels weird
From the outside
It feels like a different game lol I just keep hearing (this doesn't work outside of natlan)
I hope they don't do that for snez
But for snez I hope they have weather prohibitive shit
Childe's gliding voice lines make it feel as if gliding just isn't possible in snez cuz of the snow",Not Toxic
"THI S CAHRACTER IS INSANE
GODLY DPS",Not Toxic
Suck my dick,Toxic
"Cygames cooking with this collab banner
Cooking garbage",Toxic
"Yeah pretty gross that its on its own roller
and it doesnt have flash characters
Like just lower flash fest character rates or something dont FULLY make people choose between fun collab characters and flash",Not Toxic
"Ork strong
So we make him alive
U should like orcs Dylan they quite literally are
Fungus people",Not Toxic
"Also the fact that the Adeptus Mechanicus literally nuked mars so no one could live on the surface and they lived underground
crazy",Not Toxic
"I  love when the leader of the VII killed one of the leaders of XX but actually we don't know and he could have been XX's leader's twin brother, but they swapped identities for the time being. Apparently XIII also killed the other twin brother but it could have been one of XX's legionaries in disguise since they all got plastic surgery to look like him.
Or it could be that both of the XX leaders are alive and fighting eachother, or both XX leaders could be loyal, or both could be traitors. Or both XX leaders could have died.",Not Toxic
"The fact that elderly actually have soft spot to autistic/people with mental disabilities also shocking, with how bad mental health is seen by older generation
You're pretty lucky to have such an understanding colleague",Not Toxic
"They are losing money
Every other Cygames game that is on the App Store (gbf isn't) is making 1/2 to 1/3 what they used to make
Like Uma is no longer constantly in top 10
Every big gacha got pushed down by HoYo
Even FGO is making just a fraction of what it used to
While the 3 big hoyo games and a few other big Chinese titles are taking top 5 spots regularly
So in that sense they're probably desperate for revenue
Gbf is also really old now and will naturally just bleed player",Not Toxic
"Forgot about Clarisse getting uncapped
Her 5* fate episodes are giving me whiplash from her previous ones",Not Toxic
Unscope you fucking monkey,Toxic
FF Yasuo fed the irelia,Toxic
"They made rough blue gems go from worthless to numerous max preorders
Which can only come from 2 nodes in valencia
My workers are not leveled up yet, but I can say its worse money than afk fishing
How that compares to other worker passive income, I dont know",Not Toxic
"it's so weird, sometimes, upon using any teleport, they will only apply the new x and y coordinate, but keep the old z coordinate, so you will be at the same height, also once had it happen that I was below ground level after teleport",Not Toxic
"It is steady if the game doesnt lag or dc you
The old fishing system was more lag resistant than what we have now",Not Toxic
"undergyffin is shai friendly, all oluns instances are shai friendly but lets be honest here doluns 1 is trash, elvia trolls is good when you tryhard double rift and get 15k (lvl 2+ agris) trash with low ap, DSR you can grind average trash/h and is agris efficient, Turos dekia is pretty good since the cap isnt really high and you can overperform easily",Not Toxic
"but then some tards started lowering the prices of dawns
and yeah i agree it sucks now
dokkebi also sucks major ass",Toxic
"Some infos to reworked darkseeker. AP breakpoint is 949ap. Ap Cap 1150AP to 30% effectivity. Shai friendly as you fight 1 pack for longer. In first phase you can focus only 1 mob and the other one dies with it. 2nd phase: Dont move when the minions spawn and let them pile up before dashing behind them. All mobs hit really hard, but with shai hp pool it is not too bad. Other classes will struggle for sure. Mony per hour i wait for official release but doesnt look bad in my first impression.",Not Toxic
"at spots where you don't need to fill ap vs dr gap, about any class can outdo shai, was pulling 9k more at honglim with same loot buffs just using a tagged succ nova that I am not fully proficient with and pri storm devoured blackstar awakening and minimal consumable buffs",Not Toxic
"man i need a brawler class
something DR
like i like how awk musa feels but im not gonna swap to eva
mystic is eva too apparently
and i aint touching Zerk or Striker, i have integrity kek
any ideas?
just wanna spice things up, im a bit bored of shai's pvp",Not Toxic
"Potentially stupid question but does anyone know if the requirements for auto sprint on t10 horses has changed? I'm at artisan 9 for training, haven't played since the family-wide life skills unlock happened, but now I can't auto-sprint on my Big Shiny Horse anymore. Works fine on lower tier horses",Not Toxic
"hey if someone could help a newbie shai.. I was trying to learn reading here  the chat.. is this the correct way to grind doluns 2?
when msg appears, buff the 4 songs + healing + z + e
when it spawns, hold Q for 1 tick (if party is strong) or like 3 ticks (if lower gs)
then hit from behind (do I try killing the arms or just go to back and try not to kill it?)

I saw people focus the arm and after the iframe, then misty?",Not Toxic
"do we have like a lower base ap? I'm newbie yet on shai, but just checking if my total ap was right on garmoth.. (assuming I'd have a primoridial artina)
it seems my dosa has the same monster ap even though primordial would have more monster ap? and less species dmg ofc..
and yes, I'm not adding the 30/60ap we have from e+leaf",Not Toxic
Just because I don't use suns fury cancel doesn't mean I'm not being optimal. There are other ways of working with her kit like wgw to be optimal rather than trying to use suns fury cancel for 1 second of protection in a situation where you need to be protected instead of just proper positioning. Also suns fury cancel is not faster than from hotba,Not Toxic
i mean just from looking at warscores and nothing else id say u need to learn how to position better instead of trying to do some wgw tech,Not Toxic
Choice has been complaining for long on shai but lets be fair having shai mandatory for stuff like pvp or doluns and if one side doesnt have shai its auto lose is just bad mechanism from PA,Not Toxic
"They (grind zone devs) are zealous about the design of spots and making it difficult, challenging, and 'fun' but like in a painful way. I'm not sure if they wanted it to be equally rewarding because the conversation was short and the only thing they said was about how they have a crazy amount of future gear that may or may not ever be in game but is fun to 'stress test' spots vs the current and potential future of gear. 
To kno what I mean, think original Crypt, Ash, Dehkia Ash.
Things they hated: oluns, spooder cave
They said group grind spots are hard to balance cuz players can just be carried by their friends so they prefered solo spots.",Not Toxic
"I heard PA struggles cuz it is a revolving door for devs who struggle to be allowed to impliment any ideas as the scene is stiffled by an oligarchy of lead devs.
which is tragic if true and even more saddening if the bit about shai is true.
ofc as a shai player i think the style and design of the class was interesting. Choosing a boomerang was also pretty cool as it is a rarely used weapon. Kinda reminded me of link with the bomb shaped vitclari, it is just a shame how the class turned out.",Not Toxic
"The only change I really disagree with was the 33% BSR nerf. I also think he takes a lot of shit away from shai and is missing some compensation.
Also misty being a stacking buff with how slow and vulnerable it makes you will mean shais die before the 'ramp up' even matters.
They would have to return misty to like a 30s cd which would mean in some content shais would be spamming misty or stacking multiple shais",Not Toxic
"Problem is there are too many classes that are vastly different from each other and it's near impossible to balance them in PvE, let alone PvP without fully reworking everything
PA don't have it in them to do it, because they know the player base wouldn't be happy to see reworks to every class",Not Toxic
"Im just gonna wait and see whatever the fuck they do to shoi, if they do anything that is
Game lead designer could very well just be like : yeah nah I want Shai to be broken at group still
Divios only gave a suggestion, doesn't really mean that they will agree or do it in some capacity
My hope is a rework (unlikely but copium)",Not Toxic
"BDO community is way too unreasonable, especially pvper side more so, although PvE side can be just as awful
And lifeskillers is fine until u touch the more hardcore lifeskillers",Not Toxic
Yeah i see him eating more dirt than mike,Toxic
"it doesnt really fix the issue they want so much to be adressed
because to fix that you either have to fully rework the class, or kill it to the point no one plays it
either way this damn sheep dont understand it
we will see and wait
wouldnt be surprised if they just did some half assed changes",Not Toxic
" Other classes complain about the group pvp but shai just makes other classes more fun to play. The f buffs are for other classes, the misty lets you kill perma SA classes. How many times does the shai get the kill? Playing proper shai sucks a lot to play already as a buff/cc bot.
Everyone wants to nerf the class whos only role is to let other classes have more fun",Not Toxic
"I want to level trading to get more money from afk fishing. I have a bunch of wood just rotting in Calpheon, I moved it to Grana to process... Could I process it, make it into boxes and somehow ""powerlevel"" my trading level? I'm at Skilled 8 at the moment and I assume just getting to Artisan or Master 1 would help a lot.",Not Toxic
"whispers I refuse to take my trash crates across the Ocean and I walk them to Grana, myself.  I am aware I am losing XP that way, but, it's a sacrifice I choose to make.",Not Toxic
"we are 1 of the most active and vocal communities so they are not overly eager to rock our boat either
we have consistently been one of the loudest about unfair designs. ??
but I'd like to state that i also think we try hard and want to work with PA to have fun in bdo as a support",Not Toxic
"I'll be honost I did NOT have faith in divios cuz when i was in cho he made me feel a bit like he might be part of the jerks who just hate shai
However, in the months that followed and particularly right before he quit. I revisited him on issues since he was bringing up shai stuff and I wanted to know if he was gona be a srs issue not just a jerk. I was happy to hear that his understanding of the class had really evolved and a lot of what he said was not just one sided destruction but an understanding that I hadn't experienced before.
So, for now and until he gives me reason to hate on him. I'm gona grant him a bit of earned faith to say that he prob pitched our issue to the devs in a pretty good way.",Not Toxic
"I did. at the time I went full acc because I was like ""well, I already do so little damage (in pvp) so more AP seems meaningless, at least if I can make sure I hit them if they're eva I can do something to them"" 
this was when I was mostly doing open world pvp, hunting red karma players and arsha
but alas, the black robe is gone",Not Toxic
"anyone has a screenshot of garmoth's class tier list?
i want to change my tagged character but not sure for wich one
damn nvm
i dont want to buy weight limit
Shai free weight passive is too good",Not Toxic
"I mean I can't see how tf you kill that golem in 10 secs, 20 maybe, but even then the waves are capped
My best hour in only missed the cap on the first wave after first golem and made 8.8k
Unless they are counting till arm after the hour is over
Which is kinda like cheating your hour as you add an extra 3-4 minutes on ",Not Toxic
